Ratings,Reviews
3.0,"I'm always excited to try a place when it is new. I heard about Fable and made my reservation for a Friday night around 8pm. We were a little early and were seated right away. The location is convenient and easily accessible at the upper end of Castro. The atmosphere is pleasing. They used the current trendy slate grey with taupe coloring. There is a mural on the long wall. Orange antler horn light fixtures add a pop of color. The bar cozies right up to the kitchen, which is where I will sit next time. The staff was very pleasant and attentive and our waitress was great on suggestions and knowing the menu. Now the food... It wasn't trendy enough to be interesting or simple enough to qualify as comfort food. It was tasty enough but not memorable. The restaurant is new and the menu may develop itself.  One exceptional point however was when our plates were picked up, the owner ,Eric, came to our table to ask if we didn't enjoy the macaroni and cheese. We explained there was nothing wrong with it but just not to our liking. When we received our bill, which was very reasonable, the dish had been removed from our bill. That is customer service. When we left, I made a point to express to Eric that his action was exceptional customer service. It is apparent that Eric is passionate about his restaurant. I can appreciate anyone that loves something that much and makes an effort to make it an exceptional experience to the best of their ability. I intend to come back if nothing more than to watch them grow as a local restaurant in the Castro and to show my appreciation for Eric."
5.0,This place is just amazing. Food is always delicious and the service is always excellent. This place can get pretty busy so I would recommend reservations.
3.0,"Really cute back garden, good food. Yelp posts my review as a tip of its not long enough so making this longer bc I use reviews as reference"
4.0,"Adorable setting and back patio.  The staff was helpful and wine pairings were great.-Salmon was OK-House pasta with house italian sausage was excellent-Truffle fries were good-Pork chops with apricots was amazingLove the setting, and staff.  Will definitely be back!"
5.0,"Great local fare, the service is really friendly with a great attitude.  Had the caprese with heirloom tomatoes to start, then the best pork chop I've ever had in my life.  Some of the best food in Castro so don't miss it!"
5.0,"This place was amazing! I went for brunch with friends on a Saturday and we loved everything. The back patio is gorgeous and relaxing with heat lamps that make it very comfortable but not too hot. The pancakes were fluffy, omelette was cheesy, French toast baguette was decadent, and the fried chicken sandwich was incredible. Not to mention the awesome mimosas! I'll definitely be going back to check out dinner."
4.0,"2/19/13 DinnerSolid 4. Our party of 5 arrived promptly for the 7pm reservation. I have to give the architect at McMahon the credit for making this space so beautiful: antler light fixtures, warm apple green wall, cabin wall paper, an an open kitchen.We were seated against the wall right behind the kitchen. The table to be honest was a bit crammed as three of us squeezed in. Ambiance fine and intimate.We tackled the American-style menu with quite some gusto. For appetizers, we enjoyed:*Cream of Cauliflower Soup (x2): Served in the perfect temperature, not too hot, but enough to warm you on a cold night. The chive and cummin added a nce kick to the very creamy soup.*Beets and Goat Cheese in Parchment: Beautiful concoction. Roasted walnuts crispy, and I always love leeks. *Braised Pork Cheek (x2): OMG this is heavenly! Served with diced granny smith apples and a cider vinaigrette. Cheek cooked well and tender, but never stuck in your teeth. Nice balance of sweat and salty flavor.For entrées we had:*Duck Breast: Fat is rendered very well in this dish. Sweet and savory.*Crispy Skinned Chicken: My friend kept voicing his appreciation of the dish. Thinly crusted chicken breast served with a sweet potato puree.*Pork Chop: Thick, plump and juicy.*Pot Roast: Cooked well in cabernet sauce, the meat melts in my mouth*Salmon: Crispy on the outside and juicy insideOur server was friendly, always checking on us but not intrusive. Along the meal we had a bottle of Côtes du Rhône red. The most lackluster item would be the bread, a bit tough and stale. Also for a fine dining restaurant, I recommend Fable to consider linen napkin instead of the paper. Fable is a fine addition to the Castro restaurants and I can see this place do well there.Patio is under construction. I was informed it won't be up running until September for indian summer brunch.Dinner for 5 $190"
5.0,"THANK you Fable for helping elevate the Castro Street restaurant scene. Like your delightfully charming sister, Anchor you are a welcome staple in our neighborhood. Loved the grilled asparagus, the duck confit, and had trouble resisting the delish salted butter/bread. My husband had a pork loin he enjoyed along with some tasty grits.We were able to score a seat at the bar with no wait without reservations (on a Thurs night) but there were folks waiting in line right after we were seated so I'd encourage a resi if you can. Every seat was filled consistently. The hosts, waiters, chefs were all friendly and engaged with the guests. I loved how they went out of their way to keep people waiting comfortable, whether that was pointing out their future table and how long they'd expect the wait to be, or offering them wine while they wait. Loved the new look of the interior, a definitely step up from Luna. dark, cozy, and warm vibe.They've got a new cake made of parsnips everyone seemed to enjoy. We loved the apple crisp with a nice glass of tawny."
5.0,This was our favorite place to eat from our entire trip to San Francisco! Great ambiance and customer service. The food was delicious! Highly recommend!!
5.0,The shrimp ceviche (special) and Chicken was great!  The staff accommodated our group of 8 without reservations with ease. Everyone in my party enjoyed their entree (salmon and NY strip both also got thumbs up).
4.0,"I came here with a friend after work who had heard good things about this place.We started out sitting outside as suggested by the hostess but the wind was coming down hard off of Twin Peaks so decided to head indoors. They provided blankets and the outdoor heaters were blazing but we couldn't take it. I liked how the took care of us.Ok, on to the food. The meals that I remember were the pork cheek and the scallops with pork belly. These dishes were outstanding but the portions were on the small side. I only got 3 scallops and even though they were delicious, they weren't as substantial as you'd expect.The wine we got was so-so. I also thought I'd get something a bit more special but the wines seemed ordinary.The service was good overall. I'd like to check it out again sometime I'm in the Castro."
4.0,"I absolutely adore coming here. If my wallet would let me I'd show up once a week. I've been four times now, and each time I've tried something different. Nothing on their menu has ever been disappointing. If you love farm to table freshness, this will be your new jam.  They would be smart to pair with Swirl, on the same block, and have them run their wine list - that would create some epic pairings.Hidden in back is a charming patio that looks like a fairy garden in the evening. I had to ding Fable one star just because every outdoor table is baked under a patio heat lamp - this is San Francisco, people, not the Arctic. 65 is not cold enough to heat anything. But I digress... if you are not as offended by being overly warm as I am, you will find nothing but 5 stars here.For the terminally banal, yes - they do have a brunch with special mimosas and other drinks. Just like the rest of the planet. So, if you want to fully enjoy the food, let the noisy, happy brunch people mob the patio on Sundays and go on a weeknight. If noisy happy brunch is your jam - you will love theirs."
3.0,"I don't want to be mean to a new business so I'll give them a generous rating of 3 stars. As you can see, we eat out a lot but on the weekends. It's our thing, we look forward to it. So we've been to a lot of restaurants. And as such we've learned to expect certain things with certain restaurants. Expectations for a taqueria are different than for a French restaurant, for example. With Fable yes we had some expectations. I had to reserve 2 weeks in advance since they didn't have the time on a Friday we wanted. That very rarely happens to me; usually will get reservations a day or at most a week in advance. Let's start out with the location in the Castro.. very nice. Close to everything. When we arrived, somebody (not sure if he was the host) held up a finger towards us (index) indicating he would be with us soon. And he proceeded to hug his buddies who just arrived (hey gurl!). Never saw him again. Another man appeared, maybe he's the host? I don't know he's wearing jeans and his shirt is untucked. And there's no host stand at the front. Oh we'll just trust him and follow him towards the very back table, by the restroom. Our reserved table! 2 weeks reservation and we get prime location by the restroom. Yay.So we're at our table. 8 minutes pass by.. no one says hello, no one greets us. I'm ready to leave. Maybe our server sees this on my face (he's been passing us by this whole time), and finally starts a-serving us. He's a nice enough guy; by the end of the evening he's proven himself to be very good and attentive. (But at times also finds his shirt untucked, then tucked again.. hmm this is weird. Same thing with the ""host"").We're looking around. Can't really tell what this place is wanting to project. I see deer and antlers. But they feel like afterthought. The customers are older, mostly gay men. They all seem so serious. And just unhappy. This unhappiness can be seen on the faces of the employees of the restaurant as well. Oh this is not good. I'm starting to get depressed. We need wine!So we order wine. We order some sides instead of the starters as none interested us (they were mostly salads). The mac and cheese and broccoli au gratin. I take out my phone camera to take a pic.. eek you can't tell what they are, so I put my camera away. First sign something is not going to be good: you can't tell what the food is by looking at it. And yup they were mediocre. Mac and cheese was more mac than cheese. The broccoli was more soup du jour than gratin. Neither was cheesy  or creamy enough, and they felt rushed. For main dish I ordered the wild boar sausage, and my partner ordered the pork chops. My generous rating is based on these two dishes: they were very good. And like I said, the server redeemed himself towards the end. I don't however see Fable succeeding, unfortunately. I didn't see passion, excitement, curiousity, or urge to please that most new restaurants should exhibit. This may be one day merely a fable told in a story, and not anything real."
3.0,"I was excited to try this place but left pretty unimpressed. Our group of 10 made a reservation for Sunday brunch at 1:00. We got there on time but our table wasn't ready because they were still ""setting it up."" At about 1:20 they sat us at a table for 8, which was fine because not all of our party was there yet. A few more people trickled in, so we took the matter into our own hands and moved the little 2-top table next to us over to ours to accommodate our (reserved) group. Someone that I'm assuming was the manager saw us doing this and came over and asked us what we were doing, like we just slaughtered a live pig on our table. I assured him that we had already made a reservation, and our table was not set up to seat the 10 people we had called in for. (I will say that someone ended up bringing an extra person, making it 11 people instead of 10, but it's not like we took two tables to fit the extra person - we took the one table with two chairs that we should have had in the first place.) I didn't get a chance to ask others about their orders, but everyone seemed generally pleased. Both a friend and I ordered some salad with goat cheese, though the only cheese we saw were very small shavings of something that was plated underneath the greens. The server assured us that it was goat cheese (false advertising if you ask me), but otherwise, the salad was good. My bad for not ordering something more substantial and conspicuous. The blood orange mimosas were excellent - a good champagne/juice ratio. Our server(s?) were very friendly and attentive and did a fantastic job filling our waters, clearing plates, etc.The back patio was also awesome, if they didn't close at 2:30 we could've sat out there for hours. I would come back to try some other menu items that look good and to enjoy that patio and those mimosas.That manager and that ""goat cheese"" though..."
2.0,"Food is decent and the ambiance is nice enough. It's good to see the Castro finally attempting to add better quality restaurants to the neighborhood. I would've gave given another star or two, but the service is kind of off. As far as the staff I encountered on my visit, they need to be careful to not get their heads too high in the clouds and remember that they are employed to ""serve"" patrons not the other way around."
5.0,"This place is a gem. We have been coming to Fable for the last two years, love brunch and dinner. Great food and they will substitute for a Gluten Free meal, great ambience, great staff and Eric the owner is an awesome guy who really gets to know his customers. Highly recommend this place"
4.0,Stumbled in here for dinner. I ordered the kale salad and the lamb leg for my entrée.  The kale salad was very delicious and had the right amount of acid to it. The lamb was cooked medium rare and perfect. I had thought it would have been a whole leg of lamb but it was sliced up. I had wanted to gnaw on the bone. Overall good experience.
5.0,"Fable, what can I say I have been here numerous times and never had a bad experience. The service and food has always been great and worth every penny. This small spot is cozy and great for the Castro. It's a hidden little gem..shhh.Anything, you choose will not disappoint your palette"
5.0,"My new favorite brunch spot! We went on a Sunday at 11:15 with a reservation made moments before ( I think we got lucky). We got a spot on the back patio which was so relaxing and sentence (especially when you have a hangover). The plants and set up of the patio was beautiful! Our friends ordered the pork Benedict and said it was exceptional. My boyfriend ordered the chicken sandwich and loved it. I tried it and it was the best chicken sandwich I've had in the city, yet! I am an eggs Benedict girl, but the second I saw the banana pancakes on the menu I knew I had to try them. I'm so glad I did! They were by far the best meal! My boyfriend and our friends tried a bite and we all agreed the pancakes were our favorite. Seriously SO GOOD!!!"
4.0,"Nice presentation of the food on plates. They have a good variety of brunch items, friendly staff and outdoor seating on the back patio. Fable was a great experience! We will be going back. The Bloody Mary was fantastic, as was my peach tartine. Delicious! Their covered back patio and fountain were cute as well."
1.0,"$25 + tip + surcharges = over $30 for a few tablespoons of C grade risotto. Dining partners salmon the size of a playing card. Chicken tasting rabbit came with a super stingy dollop of mashed potatoes and 1/2 carrot the rabbit did not get a chance to eat.It's been quite a while since I've run into a dinning establishment emphasizing super small portions at super prices for the sake of pretentiousness. I thought that whole thing died as unsustainable a long time ago.This is the worst food/value proposition I've run into in a long time and that includes a few pretty expensive Michelins.Poesia or Frances is a much, much better choice. Then of course there is Mama Ji's.I was gonna give this two stars cause the dessert was good and the beer reasonable. Eating here you will have lots of room for dessert. Maybe another star cause the service was good. But one of the dining companions had some nasty intestinal issues shortly after the salmon. Injury to insult."
5.0,awesome food! Loved the quinoa bowl. Was delicious and healthy. Great vibe and garden setup for brunch. Great outdoor seating!! Friendly staff!!
5.0,"Food was amazing. Appetizers and mains were all delicious. Good prices for higher end food, as well and great service. Will absolutely come back."
5.0,I know i have written a review about Fable b4 but i really like to update how wonderful and amazing the staff and owners have become with the peeps . We generally choose a different place around the hood to do bday brunches and well this month was Fable and well never disappointing at all . We requested our fav table and we got it and the service was outstanding . The owner sat us and also came back to check with all the tables and peeps to make sure everyone was happy and satisfied with their food.  We always joke about places running out of coffee cups for it did happen and the place we went to was only open for 30 minutes before we arrived. That is a big NO NO on a Sunday esp brunch. But that would not happen here at all and I truly think the staff would run arcoss the street to PHIZ to get us coffee if they ever did run out! lol.. I just wanted to really say how wonderful it is to have places in the hood STAY and the hood support them by going to then for they are dependable . I love it ! Thank Byron and all the other staff at Fable for making D's birthday a wonderful one!
4.0,"A great surprise. The patio is fabulous, the food and service were solid, and the strawberry shortcake was the best I have ever had outside of my mom's kitchen . Worth a visit."
4.0,"I was convinced that Starbelly was the only good restaurant in the Castro (and lez be honest, Starbelly ain't THAT good), but I'm glad that I can add Fable to the list. Their menu is kind of like Miley Cyrus: you know she's basic as fuck, but you like her anyway. My main take-aways:-Remember to get the chicken. -Remember to get the corn and shishito peppers (when they're in season)-And most importantly, remember to starve yourself prior to eating at Fable so you can have your daily carb limit with their mac and cheese. Trust me, it's worth it."
4.0,"If I were one of those people who gave five stars for everything that met all my expectations I would, but I'm one of those who only give one- and five- star ratings for experiences that are either horrible or wonderful. This is okay. I have seen this space cycle through a number of restaurants and this iteration is about as good as any of them. The pricing is about what you'd expect or a little better, the food is about what you would expect or a little better. They have a nice patio. There are some interesting things on the appetizer menu but I cannot remember what they are now. The service was better than average, probably because the restaurant is small and they've plenty of people. I would say the best thing about Fable is that it's a place where you can get a pretty nice meal and actually get into (all of the nice places we used to drop in on are totally mobbed nowadays)."
5.0,"The French toast on the brunch menu was delicious. Was sat outside and, despite a hailstorm, remained dry! The wait staff were very friendly. Will definitely go back"
4.0,"Soft opening tonight. I felt at home in this environment . Amazing service( thanks Keith) very hands on approach to engaging customers.. I'll come back. Food was well presented and thoughtful flavors. A hit!Back to Fable for Valentines dinner. Another winning dinner. Byron definitely sets the tone for the restaurant and the service was excellent. Baby beet in parchment appetizer made me wanting more. I had the pot roast. Flavors blended well, melting in your mouth deliciousness."
5.0,"Hi, We went to fable for dinner i had the steak and my friend had the chicken with the bottle of wine, it was awsome place to go, it's a must try out place."
3.0,"Came here for brunch. Loved the garden patio dining and the burger was juicy and flavorful. The fries were pretty good. The wedge salad didn't look gorgeous but it was very tasty. Point Reyes blue cheese, beets, a variety of tomatoes, and crispy bacon pieces with a crisp wedge of iceburg was refreshing and delicious. The crab entree was tasty but the avocado/kale mix under the crab was just too mushy and soft, and the wonton strips too soggy. Service was adequate and friendly and the mimosas were only $9 each"
3.0,"Not that great of a brunch. The food overall just wasn't good, not too many potatoes and they looked pretty bad, eggs also didn't taste that great. Haven't tried dinner though"
1.0,"We went for brunch on 8/2/2014. We ordered the Western omelet.  It was tasteless, no only the omelet, but also the potatoes were tasteless, onions and red sweet peppers were burned. Well, we are not going back EVER!!"
1.0,Aah where do I begin with this mediocre eatery?  Slow sloppy service and they have the gall to use cheap yellow American cheese in the burger.  Inexperienced waiters.
4.0,"Been here twice now and would say that 4 stars is a great rating for this restaurant--the food won't absolutely blow you away, but you'll still get a very good meal. Each time my gf and I have tried the special of the night--1st it was a scallop and caviar dish that was incredible, second time around it was a corned beef dish in celebration of St. Patty's day. Why mention this? It seems like both times the seasonal dishes were more creative and came together better than the dishes we got off of the regular menu (the scallop and duck confit on the menu--tasty but heavy). Maybe it's just luck, but the chef really knows how to make a nice special dish with fresh and new ingredients. The service here is 5 stars--all the stuff you'd expect from a nice restaurant in SF. Overall a good place for a date night/small group dinner in a safe neighborhood where parking isn't too rough. Plus it's never a dull time walking along Castro street."
5.0,"My friend recommended this place as its his local favorite and I can tell why - great food, reasonable prices, good service, and fun environment.My friends and I split 4 bottles of wine (recommend their cab), appetizers, 5 entrees, and 2 desserts (def get their chocolate dessert) and it was only $90 a person for all that food."
5.0,"Absolutely outstanding meal.  Wife and I went here for our 1 yr anniversary dinner (we wanted to keep it casual).  Really outstanding beginning straight away with their warm bread and pink salted butter.  The fried pork cheek was possibly one of the richest things I've ever eaten in my life, and the pickled salad they serve it with is perfect.  The portions aren't huge, but between the bread, app, two entrees and dessert we definitely didn't leave hungry.  The wine wasn't the best I've ever had, but it was a blend, and not too pricey (like 30$)."
4.0,"Went there for an early dinner before a show at The Castro. The outside was a little nondescript and hard to find, especially with the sidewalks being torn up all up and down the street for renovations. Inside though was stylish and a great atmosphere. We dined on the back patio, which has a canopy and garden and fountain. It was a very pleasant environment.The service was outstanding. Attentive without being overbearing. I'm not a wine drinker, but our server made a recommendation and it was probably the most I've ever enjoyed a glass of wine.We started with the Dijon Crusted Braised Pork Cheeks, which were OUTSTANDING! The serving size was just barely enough for two, but it just made you appreciate it that much more. The rest of the meal was a little hit and miss, but I think my wife enjoyed it more than me. I got the rabbit, done two ways. Part was breaded and served with risotto and a okra gumbo with the remaining rabbit being stewed. I thought the crust on the rabbit was way too salty and over seasoned. That may just be me though, I know I'm a little more sensitive to saltiness than most. My wife was able to finish it for me and didn't have any complaints.The prices were a little high for a casual after-work hang out, but for a date, I would definitely recommend checking it out."
5.0,First time I really enjoyed this place so I went back for second time with my fiancé. I love how they greet you upfront. The restaurant has very low lighting which makes it very romantic.I really enjoyed their house wines as well as their food. I am not going to talk about my specific food because they keep changing the menu. I would 100% recommend this place. It is a great ambiance with great food and its quite enough that you can hear each other.
4.0,"Fable is a cute, charming and cosy little restaurant in the heart of the Castro. The quality of service and the ambiance definitely make up for the lack of space. The staff is very friendly and the outdoor patio is gorgeous - perfect for brunch on a sunny day. The food is amazing. The grilled king salmon is by far my favorite. The combination of sweet and savory with a touch of crunchiness make this dish very unique and tasty. Highly recommended!"
