Ratings,Reviews
5.0,"The ambiance here is perfect. I love the garden patio - it feels so magical especially at night when they turn on the string lights and candles. Food was decent too. I ordered the Dijon crusted pork cheeks and baked Mac & Cheese and really liked both. It's a bit on the pricey side, but the ambiance more than makes up for it. Overall a solid place for dinner for me and my friends."
5.0,Perfect  wow! What a wonderful experience! Great food and service! The menu is great and the outdoor patio is heavenThe beet salad is very tasty- if you are questioning adding the chicken- easy yes. Seasoned perfectly The chocolate mouse with homemade whipped cream and  touch of smoky salt is worth every calorie
5.0,"Such a cute spot!Went here for lunch on a Friday - we booked some tables via the Yelp site an hour before driving over (highly recommend making a reservation as they do book up fast). They have their brunch menu available until 3 on weekdays.The outdoor patio is so cute! A breath of fresh air in the city (quite literally). We got the fried chicken sandwich with a side of fries and it was wonderful (with a sweet brioche bun)Staff are extremely friendly and helpful, an overall pleasant atmosphere. Would highly recommend coming here!"
3.0,"Fable was alright in my opinion. The vegan lasagna was good! However, definitely go here expecting to shell out some cash for only slightly above average good. The portions are also really small in my opinion. We also weren't seated in a great spot despite making reservations beforehand, we were right by the entrance of the backyard patio area but not inside it really. You're paying mostly for the ambiance here, which is fine! Just go for the pics, eat some pretty good food, and drop more than an average amount of cash. I hear their brunch is better though!"
4.0,"We came here for brunch and on the outside, it looked just okay and the menu was pretty limited and prices were a little high BUT I was pleasantly surprised on how nice it was in the patio. The ambiance is great. I love the pretty plants and the arrangement of the patio. We made reservation for 2:15pm on Saturday in advance. When we came and checked in at 2:15pm, we were told that the kitchen would be closing in 10 minutes. I was taken aback. Why would they offer reservations all the way up to 3pm but not inform their customers that kitchen won't be open. Why would I make reservation for a limited drink menu? I thought that was bad on their part. Be clear with their reservation times and what they could offer at those hours; otherwise, don't allow us to make reservation if you can't serve us food. Anyway, everything worked out. We were able to get our food. The staff was also very friendly. The food was good. It's not amazing but it's solid. I got the fried chicken sandwich and I thoroughly enjoyed my meal. The seasonal mimosa was also good. Overall, it was a nice experience despite the small hiccup."
5.0,"I've loved Fable forever! Their food and staff is just so amazing! I've tried a lot of their food, but their vegan squash lasagna is particularly delicious. I tried it on a whim, and now I get it all the time. I love what the squash brings to the lasagna. And of course, you have to have their chocolate mousse to finish everything off. It's perfectly light and chocolatey and satisfying after such a wonderful meal.I often order from different restaurants on Hyperflyer because you can order directly from the restaurant without all the extra fees of other sites, and I just saw that Fable has been added! I'm going to celebrate by ordering and picking it up for dinner tonight."
4.0,"Let me start by saying the outside patio atmosphere and service is 5/5. The downside of here is the lack of options. The menu is very limited. Especially for someone with dietary needs. As a vegan I really only had the vegan lasagna which was okay. Too heavy on the vegan cheese for my liking. My friend ordered the tuna appetizer and said it was good, but wished the menu had less pork options since she doesn't eat that. Overall we enjoyed our wine, the atmosphere, and the the okay food."
5.0,"This place was so cute!!! If you're in the Castro district and want to dine somewhere romantic, this is your spot! No joke, this place is by far magical. From the food to the ambiance, this place is perfect. Staff is super friendly. Making reservations through Open Table app, I highly suggest it. This place does get busy and if you have no reservations, you're likely not to be seated as there's limited seating.Came here 'cause I was browsing locations for a romantic/or fun restaurant and this poppes up on search results. Later that day upon searching, my Tik Tok app had a video that showed Fable, the restaurant. Instantly, I knew I had to book a dining experience here. My plus one and I enjoyed our evening with great conversation and laughter while eating delicious food. This place is perfect during coronavirus times. Outdoor seating woth lovely plants all around.For starters, we had the macaroni and cheese. Simply devine! Crusted cheese with light breading, it was way too good. I had a seasoned chicken breast over mash potatoes and greens. Flavor to thr max and not dry, as I was a bit worries before ordering. Nope, it met my expectations. My date had a hamburger that looked ravishing. Portion size was good, he had no complaints."
3.0,"I really wanted to like Fable. Maybe it was because we came for drinks and dinner instead of brunch, but our experience, and service, were rather mediocre. Vegan lasagna and fries were tasty but expensive for the portions, and wine was ok but nothing spectacular. The patio in Fable is beautiful, although sadly we didn't get to see much of it since we were seated next to the door and the beverages.Brunch experiences seem to be better so maybe come then if you're itching for a visit."
4.0,"FLAVOR (3.5/5): Tried their fried chicken sandwich and it wasn't anything spectacular! As all of Bay Area is coming out with their own fried chicken sandwiches, I didn't find this one competitive at all. Their sweet potato chips, also were more rubbery than crispy. INSTAGRAM WORTHY (5/5): The outdoor patio in the back is breathtaking with all the plants you are surrounded by. It's like eating in a jungle but with heat lamps! Appreciate all the decor to make your dining experience worth while. SERVICE (4/5): Friendly staff, did check ins with us but left us alone for the most part which I appreciate! We didn't have a reservation but they still took the chance to give us a table right away. TAKEAWAYS: I find their menu for lunch super limited, a little too picked over in my opinion. Not only that, but their prices are on the steeper end. You're paying double for a ""fancier"" version of what you'll get at an equally tasty place perhaps 15 miles away. Would come back for the ambiance but not the food."
4.0,"TL;DR - Fantastic brunch spot if you can sit in their patioI've come here a few times now and I think it's a fantastic spot to bring someone on a date or gathering with friends, especially if you can get a seat in the back. I recommend calling ahead to book or using Opentable.The food it good but not exceptional. Nothing stands out to me. They have a variety of different items, including sandwiches, pancakes, quinoa bowls, Chilaquiles, etc. which is great for friends with different tastebuds. I got a quinoa bowl and added a ham. This includes avocado and poached egg and tbh, this is the best deal on the menu. I noticed the Chilaquiles was a bit light on toppings. Fried Rocky Jr Organic Chicken Sandwich with House Cut Fries is a good value too because  the sandwich is pretty big and the fries are fresh and super crunchy.Overall, a good place for friends but too hyped up."
5.0,"Visiting an old stomping ground is an interesting experience - the Castro was a staple of my first few years in SF and it's undergone a transformation in the era of COVID. The bars are now outside and it's refreshingly buzzing with energy for those of us exhausted by the lockdowns of the past year. I've always wanted to try this place - I heard they had a great patio for outdoor dining (they do!) and decided to catch up with a friend for dinner.  We shared the pork cheeks, avocado Dungeness crab tower, mussels, lamb chops, baked Mac n' cheese (topped with crab) and pear ginger crisp. Everything was excellent but the baked n' cheese topped with Dungeness crab was the highlight of that meal. The best of it was the burnt bits (kinda the burnt rice on a bibimbap).  Crab season also just opened and the side of crab on top was the perfect accompaniment.  The lamb chop was also a special dish, particular with the Parmesan gnocchi and mint sauce. Service was good and the patio indeed lived up to expectations. With tax and tip, this was $80 per person. Just a great dining experience and highly recommended!!!"
5.0,"Excellent service, beautiful outdoor patio, and great food! I didn't try it personally, but their double double cheese burger looked out of this world!!"
5.0,"I'm so glad this place is still open in Covid. It's a beautiful place to go to for Brunch.The outdoor seating here is amazing, and the food it top notch. I got the chicken sandwich and it did not disappoint. It was nice and crunch and still super juicy on the inside.Would come back again anytime!"
5.0,"Cute outdoor garden experience during covid. My boyfriend and I were looking for some place to dine during covid, just to feel the dining energy back. This restaurant was great, very cute, and with good vibes. I had lamb chops with a glass of red wine to calm down the strong lamb taste. My boyfriend had the sauteed king salmon with horseradish in a bed corn, he said he liked the lamb dish better and I did too. If you ever get to visit this place, enjoy it!"
4.0,Beautiful garden dining experience! I would probably go here again just to experience the garden ambience! The food was absolutely fresh. Limited on veg options. But when I checked the menu their brunch and lunch options have at least a few veg options when compared to their dinner menu(where only the salads are veg friendly and no entree was veg friendly). My husband had the egg sandwich without bacon. He thought the Gorgonzola cheese didn't go really well with the rest of the sandwich. I had the vegan grilled zucchini sandwich with a mixed green salad on the side. I absolutely devoured it! The focaccia bread for the sandwiches were so fresh and tasted great! PS: furry friends are more than welcome here :)
5.0,"Recently went here for lunch. Nice back patio seating. Enough space so you felt good about being there, and the patio was lush with plants, and felt so good to be dining outdoors. The food was superb. We had the fried chicken sandwich, with French fries (delicious!) and to balance that out, the beet salad with goat cheese, and grilled chicken. Both were fresh and really tasty. The service was friendly and efficient. This place really was a gem in a busy neighborhood. I'd recommend making reservations ahead of time, just in case."
5.0,"We got lucky find meter parking right across street. We had reservation so we were seated immediately. We walk toward back of restaurant.  Into a beautiful outdoor garden. Tables were social distance. Our waitress did superb job with her mask on. She was very attentive but kept interruption minimal. We ordered tuna tower, salmon and special of day Seafood Cioppino. All the dishes was cooked to perfection. We cleaned out our plates. Perfect for girls night or date night."
5.0,"Very  cute spit with an amazing garden partio! Lamb chops are excellent . Perfect combination of spices . Extra credit for hosts. They really have an idea how restaurant works. Three of us stopped on Saturday night at 7 pm at Castro !! Without no reservations. According to their reservation system they were fully booked up. However, hosts were  really  good at ""games of tables"" and found I way  to sot us! Definitely we will be back"
4.0,"Came here on a whim on a Saturday night and was able to get a table inside. Unfortunately all of the garden tables were taken, but I'm glad that we were able to try the food. Got the mac & cheese, meatballs, and burger. Everything was delicious. The mac & cheese was amazing! The meatballs... I've had better, but overall it was a good experience. We had a great waiter as well. Would love to come back and eat in the garden soon"
5.0,"I came here after Covid19 restrictions were lifted. We sat in the back patio during a beautiful day. The one thing I didn't like was that our server was very clueless about checking if we were good. We waited over 30 minutes just to get water or drinks. But the two other servers saved the day by being super attentive so that would be my negative critique of them. Food:Eggs Benedictspinach, poached eggs, hollandaise, mixed greens - added avocadoRed Quinoa Brunch Bowl with Poached Eggs & Avocadogreen and yellow zucchini, arugula, honey-lemon vinaigrette Sandwichover-medium eggs, gorgonzola spread, bacon, arugula, honey-lemon vinaigrette - added bacon & avocadoDrinks:My friends had mimosas, Rose, and water. The drinks very good.I definitely love the upgrades you guys have made since the last time I came. I also love how clean your bathrooms are and I appreciated that. One other friendly tip is to make sure there's enough shade in the back as it was very hot the time I went. Thanks again for everything."
4.0,"What a delightful garden patio dining experience! I came here for Saturday brunch with a girlfriend, we made reservations online and were seated pretty promptly after a short wait. I would recommend making a reservation if possible, there was a bit of a line outside waiting for walk-in seating. The ambiance is very pretty, almost felt like I was transported out of SF and into a garden oasis! Fair warning, if you are paranoid about table spacing for outdoor dining for COVID-19 reasons, this might give you a bit of anxiety especially during full-house weekend brunch time. I thought the tables were pretty squished together in the back garden patio, there was maybe 3 ft space between our seats and the seats of the table next to us. Granted, the tables may be precisely 6ft apart, just not the seats..The food was good for brunch. I had a crab cake Benedict and split the French toast. I thought the French toast was the most memorable dish of the meal, and the Bloody Mary was pretty good as well. We also shared a carafe of blood orange mimosa because why not. Service was friendly and as attentive as you can expect for a weekend brunch in the city. Overall, I had a lovely time and would consider dining here again."
3.0,"The decor and food here is excellent. It's such a beautiful place. I had the baguette French toast with a side of bacon which was delicious. It was soft and warm and came with strawberries. Also had the blood Orange mimosa which was really good as well. The food arrived quickly too. Only issue was the waitress. We arrived at 1:56 for a 2pm reservation. The hostess was SO WONDERFUL and told us the kitchen closed in 30 minutes, but drinks could still be ordered after that. Great. Then comes Katrina. She rushes us to put our order in. Then she tells me I have to put my mask on even though I was sitting at the table. She didn't tell the other person I was with to put their mask on, nor did she say that to any other table. I am not someone who doesn't wear their mask or take COVID seriously. I take it very seriously so for her to say that to me, really took me aback because I didn't think I was doing anything wrong and I felt singled out. Then as we're eating she comes and puts the check on the table. We sat at 2 and she gave us the check at 2:55, even though there is a 90 minute limit. She never asked us if we wanted anything else. We had wanted to order another carafe, but she didn't give us the opportunity. As we were finishing our first carafe she kept taking things off our table, but again not doing this to anyone else. We felt so rushed and pushed out. I'd like to give this place more stars, but she took away from our experience."
5.0,"This spot is adorable and cozy! My boyfriend took me here for my birthday and I was so surprised to find this gem of a garden in the back of the restaurant. The food was also delicious. We had the sesame seed seared ahi tuna, pan roasted chicken and the Mac & cheese. The tuna was soooo good! It was accompanied by grilled bok Choy, a basil sauce and mango pico de gallo which perfectly complemented the dish. So so good! Definitely getting that if I return. The chicken was a little dry but overall flavour was very comforting. The Mac and cheese was also sooo tasty. For dessert, we had the chocolate mousse which was light and not too sweet. Hope to return again for brunch in the courtyard!"
5.0,"First and foremost, the patio is beautiful.We stumbled upon this place whilst strolling through the Castro, and delightfully discovered the back patio that feels like it's from a different world. Almost like going into Narnia.Thankfully, the food stacks up to the plate as well. We had the burger, vegan lasagne, lamb, and Mac & Cheese and they were all fantastic.Also -- HUGE shouts to our server Arion. Fantastic dude, kept a very entertaining conversation while we waited for our order!"
2.0,"I'm so sorry but what is the hype on this place? The food was so not good. I would give the vibe 4/5 stars. The burger was OK, pork chop was absolutely gross. You can make a better New York steak yourself on the stove. I'm having a hard time believing these 4 and five star reviews. The only reason why i booked was because of the reviews. Save your money and go elsewhere."
4.0,"I'm very glad we went there and had a really pleasant time and really tasty food there. Outdoor seating is available during the COVID but to our safey the patio is pretty spacious and it's possible to keep social distancing more or less. The staff is keep all necessary restrictions and treats their customers very well and very politely. It wasn't so hard to make a reservation even though there were pretty many people. All the plates were delicious and we all liked them. The food looked attractive with flavorful smell. And tasted very good for sure. I gave four stars just because of one reason and it was time. We waited for our orders a bit longer than expected but it wasn't like too long. There might have been some rush in the kitchen because the staff was running between the tables the whole time. To conclude, the venue is pretty cool."
5.0,Everything here is FRESH!!!!! That's the best way to describe it. Delicious & fresh. The staff is wonderful. Such an amazing vibe and the garden is beautiful! You must try!
5.0,Such an amazing little spot! The staff is so accommodating and friendly! The garden out back is beautiful! They have a great wine list and their fried chicken sandwich is amazing! Definitely give it a shot you won't be disappointed :))
5.0,"10/10 would dine again!Make your reservation right now ! It's so cute. Everyone was being Covid safe with masks worn properly and tables were spaced out. Everything we ordered was delicious. Green goddess salad, mac and cheese, asparagus, Rocky jr chicken, and the ahi tuna all . Our server was also super nice and the service was good!"
4.0,"VEGAN REVIEW:This was my first time at Fable and I was so delighted to see a vegan entree. I don't think any of the apps were vegan but I don't eat a lot in one sitting so I was content with just my entree. The vegan lasagna was SO yummy. It had almond mozzarella which made me question whether the dish was vegan or not! It was gooey goodness. The pasta part of the lasagna was pan fried which added a lovely crunchy texture to the dish. The marinara was simple but so good. I wish there was more of the marinara but besides that, I was a very happy camper. At dinner, the lasagna was $26 which I thought was kind of pricey. The only vegan dessert I saw was a sorbet trio but I didn't have any. Service was great and their outdoor seating was so beautiful! Ambiance was on point and would be perfect for a date night!"
4.0,"I really enjoyed my experience here. The food and cocktail were delicious. Only thing is it took a while to get our bill, so we were sitting for a bit. The place is pretty busy tho, so not a huge problem."
5.0,"I was pleasantly surprised with the food and service here. To be honest, I didn't have any expectations in particular since I knew nothing about this restaurant other than seeing it coming and going. We were promptly greeted by a friendly host whom offered seating in the front or back outdoor area. The server was prompt and courteous.For the appetizer, we chose the grilled mussels. This paired well with the white wine we ordered.  We then ordered the pork chops (with sweet potatoes, and lentils) and the grilled chicken breast with scalloped potatoes and greens. I wanted to get a real taste of what this restaurant was producing. So, I also ordered a side of mac n cheese and a side of French fries. The fries were served with ketchup and an aioli sauce. The service, quality, presentation, and flavor was enough to make me want to come back for more. In short, I recommend!"
5.0,"Dined there with friends for a Birthday Celebration.   Great outdoor patio with heat lamps, tropical plants, beautiful ambiance.  Each of us ordered a different entree, salad and dessert.  All first quality.  Excellent service and great wine list!  Will definitely be back for more.  I heard the brunch is one of the best in the City"
4.0,"They have an amazing backyard patio ( great for social distancing ) with heated lamps and beautiful garden decor to make your dining experience magical - which is why I am giving them 4 stars. The service was great and they're very attentive. Menus are via a QR code and they only serve wine and beer.Food - portions are huge, we got appetizers and entrees. We got the pork cheeks which came with kale. We got the salmon as an entree which came with a bed of corn. We also ordered their spaghetti special which was homemade and a spin-off of a carbonara. I think the only reason why it is not a 5 star is that pork cheeks didn't really go well with the kale salad and didn't have a lot of flavor, but the spaghetti was delicious and flavorful. The salmon was not overcooked but I was expecting a bit more uniqueness with the flavors here.Overall a solid experience - especially with COVID and social distancing requirements. I definitely enjoyed the experience as I would in a normal situation."
4.0,"Atmosphere, 5 stars! Service and food, eh. I would return for the atmosphere again and again. Weather protected garden patio with heat lamps and the sound of running water. Unfortunately, there seems to be an issue with service each time I've come in, like having my drink delivered as I was leaving and a reservation booked while the kitchen was closed midday without me being informed. Although there have been several mishaps, if you are looking for a laidback brunch experience in a garden and are able to be patient as this new place is working out the kinks, I would recommend."
4.0,3.5 Fable is a very charming place to grab a bite to eat: Especially now when dinning outside or in an open space might be a prudent idea.Our food here was nothing special ( A burger and a sandwich) but it tasted great to be dining out.I could see brunch being fun here. Gorgeous garden setting. Service was great.
4.0,"Dog friendly*Very cute and aesthetically pleasing outdoor space. Doesn't even feel like you're in SF. We arrived on a Monday around 1:00pm. You have to walk through the restaurant to get to the back patio area. The server told us we could sit anywhere that was open. QR code was already on the table to access menu. Their lunch menu is small and only contains sandwiches and salads. Really wish they served brunch everyday, but unfortunately, brunch is only available on the weekends. There was only one server pretty much doing everything so she didn't come to our table right away, but she was super nice and attentive after it died down a bit. We had our dog and she offered water for her which was great. I went with the fried egg sandwich and added avocado. Sandwich was really good but messy! It fell apart as I was eating it. All of the flavors worked really well together but the Focaccia was a bit dry. If you don't like gorgonzola, do not order this. Gorgonzola flavor was really good, creamy and strong.My boyfriend ordered the fried chicken sandwich and it was delicious! No onions in the slaw which he loved. Chicken was crispy but tender and moist inside. We both LOVED their fries. So good!I'd love to come back and enjoy their brunch menu next time. I really hope they make it through this pandemic!"
4.0,"Came here for brunch on a Saturday afternoon. The food was really good - we got the French toast and chilaquiles. I still dream about the French toast. When I'm having a really bad day, I'll go get it. The patio in the back is beautiful & pleasant to sit in.My only feedback is that the service and overall management be improved. I called while we were on the way saying we would be running a few minutes late and with our ETA, and the man on the other end was so rude. He said we likely wouldn't be seated and if we were, our time would be cut short. He said for brunch the time limit is 60 mins and dinner 90 mins.. bc of covid. None of it made sense and seemed odd. Anyway once we got there, they seemed to not care at all and have a table for us."
