Ratings,Reviews
5.0,"Jon and your fabulous crew- welcome to the neighborhood! We've been waiting for you (literally) and patience has rewarded us. Firstly, I'm so glad you took the chance to venture out onto your own, that you picked a neighborhood like the Castro, and that you saw the opening through to the, uh....well, the opening!The ambiance is right for a scrumptuous meal such as I enjoyed last week. The pork cheeks are amazing, the crispy chicken even better....and who'd a thought I would like kale? Had that the second visit. The staff- kudos, and with experience, even more attentive and personable. I like to be surrounded by professionals that are so good I didn't even notice them....not quite that, but with a few more nights open (and hopefully MANY years)....it seemed the wait staff was intent on my dining experience pleasure.The space is wonderful, and with further success, I hope you will introduce those of us that haven't had the delight of dining al fresco in the back garden as soon as you can.I'm so glad you're here- your creativity, hard work and vision are a boon to me and those who come to the Castro. I will tell all my friends!"
5.0,"Came here for brunch with a large group of 8-- make sure to book your table in advance! Great service, and pretty good food. I got the fried chicken sandwich, which I felt was very tasty but not amazing (the chicken wasn't particularly stand-out). The bun was great though! And word of advice: GET THE FRENCH TOAST. Easily the most amazing French toast I've ever had, and I usually dislike French toast!"
2.0,Terrible service with even worse attitude. Waitress took 10mins to justify her incompetency rather than just fixing it
4.0,"Surprisingly good, especially compared to the choices in the neighborhood.My favorite dish of the night was the scallop crudo, which had avocado, diced pear and some hot peppers, that added some complexity with its heat.  Never had a dish like this with these combination of ingredients.  Also good were the pork cheeks, which were more substantial that I would have guessed.For entrees, the black cod served over risotto was good but even better was the pork chop.  They recently changed up the menu so that it was no longer served with grits and a honey-glaze. Rather, it had scalloped potatoes on a bed of sauteed greens.  Still quite nice.Don't think they served any alcohol other than wine.  Overall, a very nice place to catch up with good friends."
3.0,"Fable is competent food delivered at an ok price point. It is not ""OMG FANTASTIC"" but not a ripoff either. It has a non-challenging menu and comfortable and cozy. The back patio is beautiful and the lovely setting in back would be my only reason for returning. Otherwise, there are better options, mostly outside of the Castro for dining."
5.0,"O. M. G. The following are to die for: EggplantPadron peppersI was beginning to start feeling disappointed in SF restaurants; it had been a long time since I felt totally blown away by one. Thank you, Fable, for showing me otherwise!Great food and great service. I've made reservations to come back."
4.0,"I got hooked from my first visit. That time I ordered the avocado salad and added grilled chicken. It was perfect. There were fried wonton strips, and the sesame like dressing had full, nutty flavor (mmhmm). I ordered a peach Italian soda, which was refreshing and not too sweet. Service was fast, attentive but not overbearing, and friendly. The second time around was a different experience. I had the bistro burger, and added half an avocado. I ordered it medium rare, and I thought it tasted bland. I think it was under seasoned, and wouldn't order it again. I say stick with the salads. I would come back to try the french toast or sausage and 3 egg entree. On visit #2, my friends and I sat in the back patio, which was BEAUTIFUL! It was like being in mini-wonderland missing flying Tinkerbells, and I digress. Pricing is very reasonable and service was again friendly and relaxed. Super clean bathroom which is always a good sign."
3.0,"The Scallop crudo was absolutely delicious, and the cauliflower was very tasty. My friend ordered the Black Cod topped with dungenous crab. This was a suggestion by the waiter, but honestly, it was too much, very salty and adding the crab took away from the crispiness of the cod. I think both the cod and the dungeness crab would have been better separate from one another.  I ordered the vegan beetloaf, which I read some amazing reviews on, but I felt it was very dry and not very tasty (and I love beets). Overall the experience was moderate, and I don't think I will return."
4.0,"It's true when people write that we are spoiled living here in San Francisco regarding our choices in dining.But, Fable made me realize that I've also become accustomed to the way dishes are seasoned here in SF.Tonight was a revelation in flavoring familiar dishes.  The North African spiced chicken breast served with a side of ""forbidden rice"" was a wake-up call.  I haven't had those spices in a while and it was a welcome change of pace.  The rice contained bits of celery, carrots and fresh, ripe peach.  It was a well thought out dish that paired together unexpectedly for me.The soup that we started with was a cauliflower and parsnip mix.  Served very hot, it was again flavored in a unique way that caught me by surprise.Tonight they offered fresh dungeness crab as an addition to any starter so, we included it in their tarragon flavored green goddess salad.  This salad included little gem lettuce, beets, shaved pecorino cheese and croutons.Service was excellent.  We opted for Trumer Pilsner over a glass of wine tonight.  Dessert was the fresh berry tart.Looking forward to the outdoor space opening soon."
1.0,"*Sigh*. Where to start? We made reservations here for dinner on a Friday night with company in town on a whim after reading many of the reviews. Wow. The individuals who have given this place 5 (really, even 4) stars must have no expectation of service or quality of food. Totally embarrassing after raving about  the SF food scene to bring guests here. Yo, if you're eating Burger King every day this place might be acceptable, but if not, forget it. Let's just walk through the embarrassment and disaster of an evening to put it into perspective. We had reservations at 8pm and decided to get to the Castro early to have a drink somewhere else. No luck. The girls wore bad shoes and needed to sit so we decided to show up to our reservation early to have a drink, take our time, and hope they had a table. Well, red flag numero uno, this place was basically dead at 7pm on a Friday. Undeterred and oblivious to what awaited us, we were sat immediately with choice of table (Red flag 2). We took a look at the menu and proceeded to wait 15 mins for our waitress. We then ordered drinks and waited another 15 min to receive them. Not exactly setting the tone well but we gave the benefit of the doubt. We watched as the waitress attended to everyone else until finally she came back for us to put in food orders. We ordered 2 appetizers and 4 entrees (between 4 of us), 2 of which happened to be the special of the night. After placing our order we waited 10 mins and the waitress returned to tell us only 1 special remained. An intense game of Rock Paper Scissors decided the winner of the special and back to the kitchen went the waitress. 15 mins goes by and we're finally given our appetizers. The pork cheeks were average. Anyone saying they some outstanding dish have low expectations. The Brussel sprouts were standout so we were hopeful the meal would turn around. Well, let me tell you, at this point it's now 815. The waitress warns us about the wine rule outside (no wine after 9pm) and we laughed it off because hey, it's 815 we have plenty of time. The manager then emerges, tail between his legs, to inform us all of the specials were gone and 1 of the individuals in our party was back to the drawing board. Wait, what? A mostly empty restaurant and it takes you 45 minutes to tell us you screwed up the first time about the specialand none remained? What the hell is going on back there? Are you actively fishing for the protein? Well, now we're screwed. To top it off our entrees arrive 40 minutes after the admission of the screw up and the subsequent replacement order and it's now 855. Overall, the entrees were average. The duck was dry and overcooked, the tomba tuna had little flavor and the roasted chicken was average. Plus we had to chug wine to meet their 9pm rule. Despite all of the gross mistakes they made we were offered free dessert. Wow. What a manager. What an experience. They comped the entree that had to be changed twice. Two hours, two appetizers, and three entrees later (with 1 comped) with about 6 glasses of wine between the 4 of us still ran $190. Despicable. Poor staff. Average food. Overpriced. Eat pretty much anywhere else. I won't be back. If you go you're an idiot."
4.0,"*Great service. lovely ambiance. Friendly, attentive, patient with our questions, professional but not pretentious. Laid back and sophisticated at the same time!*Braised Pork Cheek - delicious and tender, rounded out well with granny smith apple/cider vinaigrette. *Pot Roast - Great flavor! Loved this dish, really well-executed.*Au gratin - good, but the consistency was too thin which made it a bit awkward to eat. The flavor was strong and it tasted great, but it seemed more like a soup with odd vegetables. (large pieces of onion, squash dominated) I ended up dipping my bread in though and it was tasty, not gonna lie.*Risotto was cooked perfectly. Most delicious maybe I've ever had!Can't wait to return. Keep up the great work Fable, Castro needs more restaurants like you!"
4.0,"Great time on patio, food was really good and atmosphere was great! A little pricey but location was ideal for a night in Castro. Be warned you can't drink outside after 9 and we had to finish all our drinks quickly. Will return for sure!"
4.0,"This place is beautifully decorated and tucked off the busy Castro and 18th Street corridor. The front of the restaurant is a bit tight  and narrow with the bar featured prominently. Not much waiting room inside so make a reservation.My friend made a reservation for our group and we still had to wait a bit to be seated. Fable helped with the wait with a few glasses of wine. Definitely an appreciated gesture while we had to stand around!Our table shared three of the salads -- the beet in parchment, the endive salad, and an arugula bread salad. The arugula bread salad was the best of the three. We wanted to try the tart but they were already out of it for the evening.I ordered the beet loaf with mashed potatoes and brussels sprouts. The beet loaf was a great, hearty, vegetarian entree.We shared three desserts, the chocolate mousse, the pineapple upside down cake and a pear crumble with ice cream. The pear dessert was the best. The pineapple upside down cake had some macadamia nuts with it that I wasn't a fan of and the chocolate mousse was solid.All of the staff were friendly, knowledgeable, and prompt. Very professional. You don't always get that at a new restaurant!I hear they have a cozy patio out back. I am really looking forward to checking it out."
3.0,"Came here on a Friday night for my friend's birthday with a party of 7 girls total. We got the backyard seating, which was really cutesy with an orange water fountain. We had the beats salad as an appetizer, which was ok, but I didn't like it because of the goat cheese =/ The brussel sprouts had that bitter taste so I didn't like it much either, but the mussels wasn't bad and their broccolini. Birthday girl chose this location because she wanted to try their lamb that everyone on Yelp raves about, but when we got there, we were told that they changed the menu two days ago - what a bummer. She settled with the ribeye, which she loved, and many of us had the porkchop with pomegranate & butternut squash. I wasn't a fan of the butternut squash because it tasted a little different from when I usually eat it, but the porkchop was cooked tender and juicy which was awesome! We all finished our meals and then brought a cake for our friend. When we got the bill, we saw that they charged us $3 per slice for the cutting fee, which wasn't on the menu - nor did anyone tell us when we got there, which was a major disappointment. They did waive it when we complained, which was nice of them, but it would be better if they told their customers before charging us. Other than that, I thought it was cute there and decent, but nothing that wows me to come back."
5.0,"Glad I ventured to the Castro for this place!  I wasn't expecting much, but I was blown away by the food.  We ordered all of our server's recommendations, and they were spot on. The food was creative and fresh, and so reasonable priced. The tangerine carpaccio with almond, fennel, avocado and habanero oil was incredible!  Sat at the high bar near the door, which was ok.  Looking forward to the back patio opening in the fall."
2.0,"It's always a little chancy judging reviews on a restaurant that has been open less than a week. The reviews here seemed gushing and with a free Saturday night, we decided to try it.The good:-The ambiance is great: not overly fussy, very classy in fact, a nice use of an odd space. The room handles noise well. We were seated next to a loud party and it wasn't deafening the way Starbelly can be. The patio isn't open yet. - The service was mostly attentive.The mediocre:- Nothing about the place is BAD. The prices are slightly too high for portions that are underwhelming. The food is okay, but not extraordinary. If the food was great, the portion size would probably be forgiven. There's much better food elsewhere in the neighborhood. We had the savory tart (both my companion and myself remarked that it tasted like leftovers). The twice-baked sweet potato was also something that felt more reheated than inspired. The pork chop was the daintiest chop I've ever seen. The pork cheeks were fine. Try it tentatively. The neighborhood has a way of quickly getting rid of the restaurants that aren't great food, good values, or interesting menus. Sadly, this place (at this point) has none of those yet."
5.0,"Came here for dinner and was pleasantly surprised at how amazing this place is.  I sat at the counter and watched the chefs prepare my meal and it was quite a fun experience watching them work and socializing with them.   Mateo was my server, and he was outstanding.  Such a fun personality and very attentive to all my needs, generous pours on the glasses of wine, and made some great recommendations.    I had the pork cheeks which were prepared breaded.  I think this is the first time I've had them that way but they were outstanding.  I also had a halibut dish with some potatoes and veggies and it was outstanding, cooked perfectly, mouth watering.    Then came a complimentary dessert which sent me over the edge, someone ordered the wrong one or something, so they gave it to me. :)  I wasn't going to complain!  Cap it all off with a few more samples of different wines they had on their menu and I enjoyed every moment dining with the wonderful staff at this restaurant.  Sadly I don't live there, so I'm not sure when I will be back but next time I'm in town you're on the top of my list. :)   And btw, please tell Mateo that I found the Chateauneuf du Pape wine he was telling me about, they currently have it at costco with the Kirkland brand name on it for a reasonable price. :)"
5.0,Awesome place. Great food. The roast chicken was fantastic. Mixed melon salad was so yummy and different.  It's hard to find good food in the Castro but Fable is the real deal. And the host is super sweet!
2.0,"Frist time I went to Fable it was two weeks ago Sunday around 11:30am, great weather and we were just looking for a casual restaurant to catch some rays and grab some food.  Me and my friend was try to looking to seat outside patio because we did not have a Reservation they are not able to accommodate table for 2 and patio area it was not that busy. Frist we sat down the table by front windows. our waitress come take the drink order .after my friend fell uncomfortable because he is 6'2 240b . we moved to the inside table.. and later on new waiter come take our food order, I recognized his face from anchor oyster bar , he was a cook there for few years..  anyway we order Omelet, strawberry pancake and side order French toast . we are looking around, we knowing the restaurant under staff. 20min later our food arrived and on the menu it said"" strawberry"" pancake. we only see few slice of strawberry on top. actually it dose have few slice strawberry cook inside the pancake.over all our brunch was not too bad..   Last Sunday last min, we decided to go back to Fable again.  because we sat inside the restaurant, we do not have a Reservation to set outside patio.we saw the waiter from last weekend he is cooking in the kitchen..we know he is a cook and maybe he is also one of the owner. This time we order "" strawberry"" pancake to start and then the Omelet and Med Rare Burger.  15min later pancake arrived, This time only few slice of ""strawberry"" on top without Strawberry cook inside the pancake..  we ask the waiter where is the strawberry, he said the strawberry don't cook inside the pancake.. on the menu""strawberry pancake "" for $12. why just say "" pancake"" $12 with strawberry garnish ?2nd courses takes  20min , I order med rare Burger it come rare and the fries and meat no seasoning no favor.. same as the Omelet.My Advice to the restaurant, They need to hire FOH management.and the cook or owner should focusing in the Kitchen"
4.0,"For all you regular Castro-goers out there, we all know that the lively district has seen it's fair share of restaurants come and go. I'm keeping my fingers crossed that Fable stays. Having frequently dined at Luna, which was the previous occupant, I was pleasantly surprised to see that a new owner had moved in, putting good use to the long hallway with stylish portraits of fable characters surrounded by a unique and cozy color palette. While the back patio section, with plenty more seating, is not yet open, we were able to secure a seat via reservation in their indoor dining area.We started off our meal with a refreshing beet salad topped off with arugula and a nice tangy dressing. While their menu changes daily, I highly recommend trying one of their salads. All of the salads coming out of the kitchen looked so delicious. And if you're not a salad person, you'll surely like the complementary Acme bread rolls served with butter and a pinch of sea salt. Delicious!For the main, we decided to share the yellow tail and chicken breast. The yellow tail was quite good with the fish cooked raw in the middle which made for a nice texture and taste. The chicken breast was cooked perfectly with every bite being as savory as the next. We paired both with a side of sweet potatoes which paired well with both meals.And to top it off, dessert. Yes, who can forget dessert. There were so many delicious items to choose from we decided to pick two including the sweet and savory chocolate mousse which every mousse fan should try and the pear and cherry crisp topped with ice cream. Needless to say the dessert was so good, we found it hard not to lick the plates. I'll certainly be coming back for more delicious goodness that Fable has to offer!"
5.0,"The service was excellent. The food was inspiring. I had asparagus with lemon and lightly shredded onion rings, meatloaf with cheddar and bacon with garlic mash potatoes, with a strawberry rhubarb crisp. The wine list is extensive and they are very articulate about these, as well as smart non alcoholic choices."
2.0,"Giving a two star due to a few factors. New Year's Eve dinner reservation, we were late, but the place was empty. They sat us on the back patio that had one other couple amongst a sea of empty tables, just inches from the only other occupied table in the restaurant. Why? Plenty of other open tables... In order to get up to the restroom, I had to physically move the table next to us in order to get out. They really pack you in. Service was slow, even though restaurant still empty. When another couple came in they sat them in between us and the other couple. We literally were sitting 1 foot apart, again, amongst a sea of other empty tables. Food was pretty good, but the NYE prefix price was fairly high and especially when they add in an automatic tip. We had leek soup, lobster ceviche, duck 3 ways, kobe beef--all very good, but we were hungry again in about an hour. Service was slow. When the waiter was tending to us, he was very good, but would disappear. Saw that other tables got bread, but we did not. Back patio needs a little ambience music, even if very low, would be nice. Nothing like having to listen to the people's conversation sitting a foot from you. What really makes me compelled to give only two stars, is the fact that I waited outside of the bathroom for a good five minutes. When the person finally came out, it was one of the lines chefs, and I did not hear him wash his hands! I looked in the sink, and it was dry--bviously did not wash his hands! I can only hope that he washed them when he went into the kitchen?! It took us forever to get our dessert and our bill, which made us late for the party we were going to. This restaurant has great potential, but they really need to concentrate not only on the food, but on the diners experience. Cramming us together like sheep then not providing excellent service, is going to keep some of us from coming back again. Oh, and make sure your employees wash their hands for heaven sake!"
5.0,"Everything about my dining experience here was fantastic. The service was attentive and everything we ordered was thoughtful, creative and fresh. I think this is a new gem of a restaurant in Castro...I would definitely go back!"
5.0,"There's only one thing wrong with this restaurant...I left my iPhone there late Saturday night and I cannot reach anyone at the restaurant this morning, Sunday 12/29. It's important that I get it back right away. The iPhone is displaying my phone numbers. If anyone from the restaurant reads this, please contact me ASAP.I will take this post down as soon as the phone is in my hands again. Thank you.(later that same day)Indeed, Fable found my phone and I'm a happy customer. I decided not to take the post down but rather to embellish on it. Satuday night's meal was excellent. We walked in and not only got the WINDOW table on a beautiful evening, but we got exemplary service and even a Pinot Grigio with a pink tint! It was delicious. And everything I ordered included crab (just now in season)...it's easy to screw up crab, but Fable does not! Check this place out...just don't get so smashed that you leave your two-day-old iPhone 5S behind! Ta ta for now."
5.0,"Love the seasonal menu offerings alongside the staple menu faves (pork cheeks are awesome!).  The melon salad with crispy prosciutto is fabulous!  The cucumber salad was (no longer on the menu) was equally as fabulous.  When available as a special dinner item, the duck breast is a MUST ORDER!   Nice selection of wine.  Service is always friendly.  There have been issues with making reservations via OpenTable; make sure you get an email confirmation."
4.0,"Wonderful little spot, cozy ambiance. We went for dinner and it was delicious. It's a little pricier than you might expect, which is why I'm giving it 4 stars, but I would definitely return; I'd love to try some of their other dishes!"
2.0,"A good restaurant in the Castro serving tasty French-y, California food is overdue. Fable seems dependable and capable of turning out flavorful, well-prepared food that is slightly overpriced. Main dishes were $22 and up which puts it into competition with some renowned SF restaurants that are more daring and flavorful.We ate lightly and had the duck confit salad and short ribs main dish. The duck confit was tasty but too much dressing turned the pile of greens into a sodden mess. The short ribs were tasty but seems overpriced at $25! If Fable wants to compete at those prices, it can't have misses like the salad, and it will have to amp up the short ribs."
3.0,"I'm really sad that I'm giving this place only 3 stars- maybe it's because I had such high expectations for it. The ambiance was super romantic, and there was even a cute outdoor eating area in the back. We started with the scallop crudo, which was delicious.  The scallops were perfect and tangy, and the bed of greens it was on was nice and light.  I ordered the lamb special, and it came out with 4 thinly sliced pieces of lamb on top of mashed potatoes and greens.  The lamb was cooked fine, but was kind of cold, which makes me really sad (and hence the three stars).  The mashed potatoes were nothing special, and the greens were just raw greens thrown on the plate.  My friend got the pork chop and remarked that it wasn't overcooked, but wasn't spectacular.  For dessert, he got the chocolate mousse, which was standard.  I got the ginger cake, which I loved for its uniqueness.  While it was not the best cake I've had, I would say it was my favorite part of our meal.  I think for the price, however, we expected something a little more."
